{
  "enabled": true,
  "entities": [
    100
  ],
  "external_service_url": "https://portal.example.com/path/abc123",
  "metric": "example_string",
  "name": "example-resource-01",
  "runbook_url": "https://portal.example.com/path/abc123",
  "terms": [
    {
      "duration": "example_string",
      "operator": "example_string",
      "priority": "example_string",
      "threshold": "example_string",
      "time_function": "example_string"
    }
  ],
  "type": "standard"
}